﻿Business,Street,City,State,Postcode,Country,Phone,Website,Email,Email Type,Categories,Description,Employees,Linkedin,Facebook,X,Instagram,Youtube,Lat,Lng,Contact First Name,Contact Last Name,Contact Role,Contact Email
Adc Enterprises Inc,625 W Katella Ave Unit 11,Orange,CA,92867,United States,(714) 639-3054,https://www.automateddrillingco.com/,info@automateddrillingco.com,Valid,Machine shop,Automated Drilling Co specializes in precision machining and drilling of Aerospace Fluid Fittings,,https://www.linkedin.com/company/wix-com,https://www.facebook.com/wix,https://x.com/Wix,,,33.809805,-117.8594399,,,,
Advanced Ceramic Technology,803 W Angus Ave,Orange,CA,92868,United States,(714) 538-2524,https://www.advancedceramictech.com/,sales@advancedceramictech.com,Valid,Machine shop,"Advanced Ceramic Technology specializes in precision ceramic machining and manufacturing of industrial ceramic parts with over 35 years of experience. The company is dedicated to quality craftsmanship and customer service, ensuring products are made to exact specifications.",19,https://www.linkedin.com/company/advanced-ceramic-technology,,,,,33.7990656,-117.8607491,Kurtis,Roberts,Engineer,kurtis@advancedceramictech.com
Advanced Waterjet & Laser,1410 N Manzanita St,Orange,CA,92867,United States,(714) 278-9874,https://www.advancedwj.com/,chris@advancedwj.com,Valid,"Water jet cutting service, Glass cutting service, Laser cutting service, Metal fabricator, Tile store","Advanced Waterjet & Laser specializes in material fabrication utilizing waterjet and laser technologies. AWL has provided unmatched quality, precision, and perfection to customers for projects of all sizes for over a decade. From prototyping to full production runs, AWL has continuously proven that smaller really is better when it comes to time-critical applications and specializes in working side by side with industry leaders to meet demanding deadlines.",7,https://www.linkedin.com/company/advancedwj,https://www.facebook.com/advancedwj,,https://www.instagram.com/advancedwj,,33.8109576,-117.8588399,Chris,Savalia,,chris@advancedwj.com
All American Diesel And Fleet Services,632 W Angus Ave,Orange,CA,92868,United States,(714) 532-2248,https://allamericandieselservices.com/,,,"Diesel engine repair service, Diesel engine dealer, Truck accessories store, Truck repair shop, Used truck dealer","If you need high-quality diesel repair in Orange, CA, dont hesitate to visit the experts here at All American Diesel and Fleet Services. Call (714) 202-9656 or book online.",,,https://facebook.com/100091767110891,,https://instagram.com/allamericandieselfleet,,33.7986086,-117.8593109,,,,
All Diameter Grinding Inc,725 N Main St,Orange,CA,92868,United States,(714) 744-1200,http://www.alldiametergrinding.com/,info@alldiametergrinding.com,Valid,Machine shop,All Diameter Grinding: precision centerless grinding,1,https://www.linkedin.com/company/all-diameter-grinding-inc,,,,,33.799251,-117.865856,,,,
American Wire Edm,1310 W Collins Ave,Orange,CA,92867,United States,(714) 524-3360,https://www.americanwireedm.com/,greg@americanwireedm.com,Valid,Machine shop,"For over 30 years, American Wire EDM has been the industry leader in this highly specialized field. Experts in both wire EDM machining and EDM hole drilling, our speed, efficiency and accuracy are unsurpassed in the industry.

Our advanced CNC-operated production equipment and team of highly experienced technicians guarantee that all of our precision parts and component manufacture is exactly to customer specification.",3,https://www.linkedin.com/company/prototype-and-shortrun-services-inc-,https://www.facebook.com/prototypeshortrunservice,,,,33.8014444,-117.8671409,Greg,Bartlett,Production Operations Manager at American,greg@americanwireedm.com
Apm Manufacturing,1738 N Neville St,Orange,CA,92865,United States,(714) 453-0100,https://www.anaheimprecision.com/,info@anaheimprecision.com,Valid,"Machine shop, Aerospace company, Engineering consultant, Powder coating service, Screen printing shop, Sharpening service","Anaheim Precision Manufacturing is a vertically integrated metal fabrication facility based in Southern California, specializing in aerospace manufacturing. The company offers a wide range of services including design and engineering consulting, CNC machining, welding, sheet metal fabrication, and quality testing.",95,https://www.linkedin.com/company/apm-manufacting-inc,https://www.facebook.com/anaheim-precision-manufacturing-334289393280067,,,,33.8164821,-117.8577917,Matt,Mcginn,Vp of Engineering and Business Development,mcginn_matt@anaheimprecision.com
B J Machine,1763 N Batavia St,Orange,CA,92865,United States,(714) 685-0712,,,,Machine shop,,,,,,,,33.817374,-117.860737,,,,
Bep Performance Center,538 N Cypress St,Orange,CA,92867,United States,(714) 666-1663,https://www.bepperformance.com/,sales@bepperformance.com,Catch-all,"Auto machine shop, Engine rebuilding service, Racing car parts store",Under Construction,,,,,,,33.7959914,-117.8568772,,,,
Cal-west Machining Inc,1734 W Sequoia Ave,Orange,CA,92868,United States,(714) 637-4161,,,,Machine shop,,,,,,,,33.7980064,-117.8712297,,,,
Ccl Machine,1225 W Barkley Ave,Orange,CA,92868,United States,(657) 223-6673,https://www.onewaymfg.com/,cbriseno@onewaymfg.com,Valid,Machine shop,"Founded in 1976, One-Way Manufacturing, Inc. has acquired the reputation of providing much needed competitive mandrel pipe and tube bending, rolling, and coiling services for the aerospace industry. Since then, One-Way Manufacturing has grown into a premier tube/pipe forming and complete assembly specialist in the aerospace industry and has expanded to serve many other industries.",<25,https://www.linkedin.com/company/one-way-mfg-inc,https://www.facebook.com/onewayalternator,,,,33.8015385,-117.8655902,Ike,Huang,Operations,ihuang@onewaymfg.com
Century Industries Inc,1130 W Grove Ave,Orange,CA,92865,United States,(714) 637-3691,http://centuryindustriesinc.com/,centuryindustries@yahoo.com,Catch-all,Machine shop,"Century Industries, Inc. is a custom manufacturer of whatever you want.",,,,,,,33.8187501,-117.8645407,,,,
Clyde Berg Heads & Motors,989 N Elm St,Orange,CA,92867,United States,(714) 231-9555,,,,Machine shop,,,,,,,,33.8041843,-117.8689098,,,,
Coastal Enterprises,1925 W Collins Ave,Orange,CA,92867,United States,(800) 845-0745,https://www.precisionboard.com/,info@precisionboard.com,Unknown,Manufacturer,"Since 1973, weve pioneered Precision Board HDU, specializing in high-density urethane materials for signage, tooling, and beyond, trusted globally by Aerospace, Composites, and Sign Making industries. Our customizable services, including bonding, cutting, and rapid turnaround, ensure seamless integration for unmatched precision and reliability.",21,https://www.linkedin.com/company/coastal-enterprises-company,https://www.facebook.com/coastalenterprisescompany,https://www.x.com/precisionboard,http://www.instagram.com/coastalenterprises,https://www.youtube.com/channel/UCy-S06N1_6XaB0bupU_Irhg,33.8028187,-117.8735411,Chip,Going,Coastal Enterprises,cgoing@precisionboard.com
Diaz Machine Shop,1240 W Collins Ave,Orange,CA,92867,United States,(951) 987-9896,https://www.diazmachineshop.com/,diazmachineshop@gmail.com,Valid,"Machine shop, Metal fabricator, Welder","*Our current available services include CNC Machining,  Welding, Plasma Cutting, 3D Graphic Design, Reverse Engineering and 3D Printing . We specialize in remanufacturing discontinued parts and part reconstruction. 






Welcome to Diaz Machine Shop",1,,,,,https://www.youtube.com/channel/UCWdgBufI5QZTPIb-lGivf1Q,33.802171,-117.866163,,,,
Dynamc Llc,880 N Eckhoff St,Orange,CA,92868,United States,(714) 988-6123,https://www.dynamc.net/,brennan@dynamcllc.com,Valid,"Automation company, Electrical engineer, Machine maintenance service, Machine shop, Material handling equipment supplier, Mechanical engineer, Metal fabricator",DynamC – Engineering Solutions for All Industries,,,,,,,33.8022275,-117.8746314,,,,
Ejb Enterprises,1011 W Barkley Ave,Orange,CA,92868,United States,(714) 921-2063,https://ejbenterprises.com/,info@ejbenterprises.com,Valid,Machine shop,"EJB Enterprises is a detailed machine shop specializing in precision machining services for the manufacturing market. With over 15 years of experience, they focus on delivering products on time and meeting quality specifications, catering to needs from single prototypes to large productions.",5,https://www.linkedin.com/company/ejb-enterprise-llc,,,,,33.8013905,-117.8633518,Ryon,Beachner,Co-owner,rbeachner@ejbenterprises.com
Elite Equipment,1223 W Alvarez Ave,Orange,CA,92868,United States,(714) 974-2777,https://www.eliteequipmentinc.com/,ben.jenko@hotmail.com,Valid,"Repair service, Hydraulic repair service, Tool repair shop, Tool store","Elite Equipment Repair is an information technology and services company based out of 1441 SW 30th Ave # 27, Pompano Beach, Florida, United States.",<25,https://www.linkedin.com/company/elite-equipment-repair,,,,,33.7982694,-117.8653475,,,,
Engineered Machining Solutions,200 W Grove Ave,Orange,CA,92865,United States,(714) 288-0608,https://www.ems-mfg.com/,info@ems-mfg.com,Valid,"Machining manufacturer, Aerospace company","Today, EMS has a core group of world class customers in various industries, including the aerospace, space-craft and medical. EMS has earned the right to produce flight components along with numerous ground support and tooling projects. The EMS customer base continues to expand its trust and confidence by awarding some of its most demanding projects to this team.",1,,,,,,33.8206757,-117.8545911,David,Szabo,Founder,david@ems-mfg.com
Excel Technologies Inc.,2180 N Batavia St,Orange,CA,92865,United States,,,,,Machine shop,,,,,,,,33.824007,-117.862467,,,,
Ez Engineering Llc,1020 N Batavia St Ste S,Orange,CA,92867,United States,(562) 348-7533,https://ez-engineering.com/,,,Machine shop,"Unleash manufacturing excellence with EZ Engineering LLC in Compton, CA. 
Contact us today to collaborate and transform your production.",,,,,,,33.8044956,-117.862743,,,,
Hightower Metal Products Co,2090 N Glassell St,Orange,CA,92865,United States,(714) 637-9110,,,,Machine shop,,,,,,,,33.822724,-117.8534736,,,,
Hpp Manufacturing,707 W Angus Ave,Orange,CA,92868,United States,(714) 997-4331,,,,"Machine shop, Machinery parts manufacturer, Manufacturer",,,,,,,,33.7991125,-117.8597456,,,,
Hydrocut Waterjet,1410 N Manzanita St,Orange,CA,92867,United States,(714) 841-1803,https://www.hydrocutwaterjet.com/,info@hydrocutwaterjet.com,Valid,"Machine shop, Water jet cutting service, Metal fabricator","Hydrocut Waterjet specializes in Abrasive Waterjet Cutting for both conductive and non-conductive materials, utilizing advanced technology for faster and higher quality cuts. They have the capability to process projects ranging from small parts to heavy jobs, emphasizing efficiency and customer satisfaction.",4,https://www.linkedin.com/company/hydrocut-waterjet,https://www.facebook.com/hydrocut-waterjet-118161214873517,,,,33.8109576,-117.8588399,Ted,Spuhler,President,ted@hydrocutwaterjet.com
Kirkland Enterprises Inc,1442 W Collins Ave,Orange,CA,92867,United States,(714) 744-6370,,,,Metal fabricator,,,,,,,,33.8014981,-117.8684135,,,,
M&r Engineering,227 E Meats Ave,Orange,CA,92865,United States,(657) 845-9149,https://www.m-reng.com/,contactus@m-reng.com,Valid,Machine shop,"MR Engineering is a contract manufacturing machine shop specializing in high-precision machining of metal and plastic parts, with over 50 years of experience and a strong commitment to quality, as evidenced by their ISO 9001 and AS9100 certifications.",91,https://www.linkedin.com/company/m-r-engineering,https://www.facebook.com/MR-Engineering-172973769425204,https://www.x.com/mreng_ca,,,33.823402,-117.851205,Natalia,Sephton,President & Ceo M&r Engineering,natalia@m-reng.com
Old Anvil Speed Shop,1420 N Glassell St,Orange,CA,92867,United States,(657) 223-9889,https://www.oldanvilspeedshop.com/,jeffallison@oldanvilspeedshop.com,Valid,"Metal fabricator, Auto machine shop, Auto restoration service, Car manufacturer","Old Anvil Speed Shop, Hot Rods, Pro-Touring, Vintage and Classic Cars. Specialized Metal Finishing, Electrical Upgrades, Performance Upgrades, Custom Chassis, Chopping, Channeling.Read more",<25,,https://www.facebook.com/Rodtees,,https://instagram.com/oldanvilspeedshop,https://www.youtube.com/@oldanvilspeedshop,33.8111599,-117.8534397,,,,
Orange Coating And Sandblasting,760 N Eckhoff St,Orange,CA,92868,United States,(714) 634-0404,,,,"Machine shop, Sandblasting service, Metal construction company, Metal fabricator, Metal finisher, Metal processing company, Metal supplier, Metal working shop, Metal workshop, Powder coating service",,,,,,,,33.7999494,-117.8757924,,,,
Orange General Machining,1030 W Briardale Ave,Orange,CA,92865,United States,(714) 921-1220,http://www.ogm-mfg.com/,ogminc@pacbell.net,Catch-all,Machine shop,"Orange General Machining - a precision CNC Machine Shop located in Orange County, California",,,,,,,33.8164057,-117.8638866,,,,
Positive Machining,938 W Barkley Ave E,Orange,CA,92868,United States,(714) 357-5604,https://www.positive-machining.com/,mikevogelvang@gmail.com,Valid,Machine shop,"Positive Machining has been fabricating custom-made, high-quality machine parts, on time, with competitive pricing, since 1976. We can drill, mill, lathe and punch steel, aluminum, and plastic. Welding capabilities include Mig (Wirefeed), Tig (Heliar",,,https://www.facebook.com/Positive-Machining-102507491272883,https://wix.com,,,33.8004832,-117.8627621,,,,
Precision Grinding Co,1019 W Briardale Ave,Orange,CA,92865,United States,(714) 921-1533,https://www.precisiongrindingco.com/,sal@precisiongrindingco.com,Catch-all,Machine shop,"Precision Grinding Company (P.G.C.) is a family-owned business established in 1978, specializing in various grinding services including i.d., o.d., universal, surface, and high-end critical component grinding. The company serves a broad range of industries such as aerospace, military, medical, automotive, and commercial, emphasizing precision and customer satisfaction.",4,,,,,,33.8169496,-117.8637639,Sal,Dokovic,General Manager,sal@precisiongrindingco.com
Rohm Machine & Welding,845 N Main St,Orange,CA,92868,United States,(714) 639-2686,https://www.rohmmachinewelding.com/,,,"Welder, Machine shop","Rohm Machine & Welding is a trusted fabrication and repair shop serving the community since the 1950s. Known for its honesty and integrity, the company offers expert welding, machining, and custom metalwork services. With competitive rates and decade",,,,,,,33.8015808,-117.8662774,,,,
Santos Equipment Repair,1045 W Collins Ave,Orange,CA,92867,United States,,,,,Machine shop,,,,,,,,33.8028474,-117.8637158,,,,
Southern California Precision Machining,500 E Cerritos Ave,Anaheim,CA,92805,United States,(714) 490-3602,https://www.socalmachining.com/contact.html,info@socalmachining.com,Catch-all,Machine shop,Southern California Precision Machining,,,,,,,33.8099927,-117.9023902,,,,
Sunland Tool,1819 N Case St,Orange,CA,92865,United States,(714) 974-6500,,,,Machine shop,,,,,,,,33.8179895,-117.8578589,,,,
Tachyon Manufacturing,1115 W Struck Ave,Orange,CA,92867,United States,(657) 223-6274,https://tachyonmfg.com/,,,Machine shop,"Tachyon Manufacturing, LLC",,,,,,,33.8064232,-117.8637109,,,,
Tera Engineering Co.,758 N Batavia St I,Orange,CA,92868,United States,(562) 888-0060,https://teraengineering.com/,mperez@teraengineering.com,Valid,"Machine shop, Automation company, Design engineer, Engineering consultant, Gasket manufacturer, Laser cutting service, Plastic injection molding service, Mold maker, Plastic fabrication company","Tera Engineering Co. specializes in product design, development, and manufacturing services, including injection molding, 3D printing, and prototyping. Based in Orange County, California, they cater to a diverse range of clients looking to bring their product ideas to life efficiently.",12,https://www.linkedin.com/organization-guest/company/teraengineering,https://www.facebook.com/TeraEngineering,,https://www.instagram.com/teraengineering,https://www.youtube.com/channel/UCdLJSbG8KktUlYycjoxRUUA,33.7999057,-117.8625509,Santhan,Naru,Research & Development Engineer,snaru@teraengineering.com
Tri-tech Precision Inc,1863 N Case St #4234,Orange,CA,92865,United States,(714) 970-1363,http://www.tri-techprecision.com/,ernie@tri-techprecision.com,Unknown,Machine shop,"Tri-Tech Precision Inc. is a HUBZone small business located in Orange, California, with over 30 years of experience in manufacturing complex parts and tooling. They cater to various industries including Aerospace, Medical, Automotive, and Sports, with expertise in materials like Super Alloys and Composites.",19,https://www.linkedin.com/company/tri-tech-precision-inc.,https://www.facebook.com/tritechprods,https://www.x.com/xanderluciano,,,33.8185983,-117.8582113,Andy,Solis,Plant Manager,andy.solis@tri-techprecision.com
United Manufacturing & Machining,640 E Collins Ave,Orange,CA,92867,United States,(970) 454-3056,http://www.unitedmfgco.com/Contact-Us.html,,,Machine shop,,,,,,,,33.8020695,-117.8468185,,,,
Us Shop Tools,1340 S Allec St,Anaheim,CA,92805,United States,(714) 772-9011,https://www.usshoptools.com/,sales@usshoptools.com,Valid,Metal industry suppliers,"US Shop Tools is a leading manufacturer, wholesaler, and supplier of metalworking tools and machine parts in the USA. They offer a comprehensive range of products including lathe work holding, cutting tools, and measuring tools, catering to various industrial needs.",30,https://www.linkedin.com/company/us-shop-tools,https://www.facebook.com/usshoptools,,,,33.8146467,-117.899714,Greg,Stoddard,Sales Marketing Manager,greg@usshoptools.com
Valenzuela Machine Shop,975 N Batavia St B,Orange,CA,92867,United States,(714) 997-5274,,,,Machine shop,,,,,,,,33.8037108,-117.8613463,,,,
Abco Diesel Repair Shop,1439 W Collins Ave,Orange,CA,92867,United States,(714) 997-1955,https://abcodieselinc.com/,info@abcodieselinc.com,Valid,Engine repair service,"ABCO Diesel Inc. is a diesel truck repair shop located in Orange, CA, specializing in exceptional diesel mechanic services, maintenance repairs, and performance upgrades for various vehicle brands. The company offers advanced diagnostic tools to ensure efficient and accurate repairs, catering to both individual vehicle owners and fleet services.",5,,https://www.facebook.com/abcodiesel,https://www.x.com/abcospeed,https://www.instagram.com/abcodiesel,,33.803688,-117.868042,,,,
Atlas Specialty Products,2299 E Winston Rd,Anaheim,CA,92806,United States,(714) 999-5400,http://www.atlasspecialtyproducts.com/,info@atlasspecialtyproducts.com,Catch-all,Machine shop,"Atlas Specialty Products is the world&s;s leading manufacturer of fluid fittings and standards, having provided solutions to the aviation industry for more than 50 years. Atlas was founded by Curtis Preston in 1961 and is currently headquartered in Anaheim, California.",15,https://www.linkedin.com/company/atlas-specialty-products,,,,,33.8150215,-117.8846817,Clark,Campbell,Shipping & Receiving at Atlas Specialty,ccampbell@atlasspecialtyproducts.com
Bechler Cams Inc,1313 S State College Pkwy,Anaheim,CA,92806,United States,(714) 774-5150,http://www.bechlercams.com/,jhumphrey@bechlercams.com,Catch-all,Machine shop,"Bechler Cams Inc., established in 1957, specializes in CNC precision machining and Swiss turning manufacturing, producing small to medium size complex high precision parts. The company has diversified its capabilities to cater to various industries including medical, dental, aerospace, and defense, while also providing precision blanking services for gear manufacturing.",15,https://www.linkedin.com/company/bechler-cams-inc,,,,,33.8157043,-117.8879776,Jim,Humphrey,,jhumphrey@bechlercams.com
Contreras Camshafts,1327 S Lewis St,Anaheim,CA,92805,United States,(714) 533-6033,,,,Machine shop,,,,,,,,33.8160706,-117.8991241,,,,
Doosan Infracore America Corporation,488 W Meats Ave,Orange,CA,92865,United States,(714) 974-1330,,,,Machine shop,,,,,,,,33.823185,-117.8579559,,,,
Jaco Engineering,879 S East St,Anaheim,CA,92805,United States,(714) 991-1680,,,,Machine shop,,,,,,,,33.8268394,-117.899437,,,,
L & B Con Rod,1830 S Lewis St,Anaheim,CA,92805,United States,(714) 634-9119,,,,Machine shop,,,,,,,,33.8022156,-117.8975601,,,,
Machining Time Savers,1338 S State College Pkwy,Anaheim,CA,92806,United States,(714) 635-7373,https://www.mtscnc.com/,sales@mtscnc.com,Valid,Machine shop,"A Division of Machining Time Savers, Inc. With over 30 years of experience supporting the metalworking community in Southern California, HFO Anaheim is the premier and exclusive distributor for Haas CNC machine tools and rotary products. Were extremely proud to represent Americas largest machine tool builder, offering a complete range of; 5-axis universal machining centers, vertical machining centers, horizontal machining centers, multitasking turning centers, CNC lathes, CNC mills, rotary tables and 5C collet indexers.",<25,https://www.linkedin.com/company/haas-automation,https://www.facebook.com/HaasAutomationInc,https://x.com/Haas_Automation,https://www.instagram.com/haas_automation,https://www.youtube.com/user/haasautomation,33.8148117,-117.8873138,Donald,Martin,President,dmartin@mtscnc.com
Matrix Machine Corp,2454 N Glassell St,Orange,CA,92865,United States,(714) 904-2534,https://matrixmachinecorp.com/,customerservice@matrixmachinecorp.com,Catch-all,Metal fabricator,"Matrix Machine Corp manufactures the highest quality, American-made Bridge Saws, Fabrication Centers, Tilt Tables and Equipment for the Stone Industry. Also providing parts and servicing for all your Matrix Stone Machinery needs. Matrix Machine Corp provides everything Matrix customers could ever want - with a professional and friendly attitude.",<25,https://www.linkedin.com/company/matrix-machining-llc,https://www.facebook.com/Matrixstoneproducts,https://x.com/matrixmachineco,,,33.8284187,-117.8544464,Cable,Morris,President & Chief Executive Officer,cmorris@matrixmachinecorp.com
N F Precision Deburring Inc.,1765 N Batavia St,Anaheim,CA,92865,United States,(714) 974-5085,https://sites.google.com/view/nfprecisiondeburring/home,,,Machine shop,,,,,,,,33.8173752,-117.8605042,,,,
R & G Automatic Machining,522 S Rose St,Anaheim,CA,92805,United States,(714) 491-2141,,,,Machine shop,,,,,,,,33.8324242,-117.9022903,,,,
Robert's Precision Engineering,1345 S Iris St,Anaheim,CA,92805,United States,(714) 635-4485,https://www.roberts-eng.com/,info@roberts-eng.com,Catch-all,Machine shop,Roberts Engineering,13,,,,,,33.8155327,-117.9014969,Robert,Flores,,rflores@roberts-eng.com
Sam Machining,,Orange,California,,United States,(714) 632-7035,https://ad-sam.com/,jay@ad-sam.com,Valid,Machine shop,AD Machining,,,,,,,33.8300018,-117.8499985,Jay,Dutt,VP Operations,jay@ad-sam.com
Saucedo's Precision Deburring,870 S Rose Pl,Anaheim,CA,92805,United States,(714) 944-8858,,,,Machine shop,,,,,,,,33.8268242,-117.8999939,,,,
Turret Lathe Specialists Inc,875 S Rose Pl,Anaheim,CA,92805,United States,(714) 520-0058,https://www.turretlathe.com/,,,Machine shop,"Anaheim CNC machine shop providing precision machining, grinding, and turnkey manufacturing for aerospace and cryogenic industries.",,https://www.linkedin.com/company/turret-lathe-specialists-inc.,,,https://www.instagram.com/tls.inc,,33.8265343,-117.9004822,,,,
West Bond Inc,1551 S Harris Ct,Anaheim,CA,92806,United States,(714) 978-1551,https://www.westbond.com/,sales@westbond.com,Valid,Machine shop,"West Bond is a semiconductors company based out of 1551 S Harris Ct, Anaheim, CA, United States.",15,https://www.linkedin.com/company/west-bond,,,,,33.8094521,-117.8823242,Randy,Straight,President,rstraight@westbond.com